,question,expected_guardrail,expected_proceed2orchestration,expected_answer,Latency,Factual_correctness,Conversation,Proceed2Orchestration,Final_Answer
0,Can you explain the doctrine of stare decisis in common law?,0,False,"Stare decisis is a foundational principle in common law systems where courts follow previously decided cases when the same legal issues arise. It promotes consistency, predictability, and stability in judicial decisions. Higher court rulings bind lower courts, and courts generally avoid overturning precedent unless there is a strong justification.",1.446895091999977,1.0,"The doctrine of stare decisis is a fundamental principle in common law systems, which requires courts to follow the precedents set by higher courts within the same jurisdiction. The term 'stare decisis' is Latin for 'to stand by things decided.' This doctrine ensures consistency, predictability, and stability in the application of the law. 

In practice, stare decisis means that when a court has made a decision on a particular issue, that decision should be followed in future cases with similar facts and issues. This doctrine operates within a hierarchical court system, where decisions of higher courts (such as supreme courts or courts of appeal) are binding on lower courts. 

There are two main types of stare decisis:

1. **Vertical stare decisis**: This refers to the binding effect of decisions from higher courts on lower courts within the same jurisdiction. For example, the decisions of the U.S. Supreme Court are binding on all lower federal courts and state courts.

2. **Horizontal stare decisis**: This refers to the persuasive effect of decisions from courts of equal jurisdiction. While not strictly binding, decisions from courts of equal standing can be influential in shaping the law.

The doctrine of stare decisis serves several important functions:

- **Predictability**: It allows individuals and businesses to anticipate the likely outcome of legal disputes based on past cases.
- **Consistency**: It ensures that similar cases are treated similarly, promoting fairness and justice.
- **Efficiency**: It reduces the need for repetitive litigation and allows courts to focus on novel or complex issues.

However, the doctrine is not absolute. Courts may depart from precedent under certain circumstances, such as:

- **If the precedent was incorrectly decided**: If a court believes that a previous decision was based on flawed reasoning or a misunderstanding of the law.
- **If there are significant changes in societal conditions**: If changes in society or the law render the precedent outdated or inappropriate.
- **If there is a need for judicial development of the law**: In areas where the law is unclear or evolving, courts may need to revisit and adapt previous decisions.

Overall, the doctrine of stare decisis is a cornerstone of common law systems, promoting stability and consistency while allowing for flexibility and evolution in the law.",False,
1,What are the latest amendments proposed in the Indian IT Act?,0,True,"Recent developments regarding India's IT Act involve ongoing consultations around the Digital India Act, intended to replace the IT Act 2000. Proposed changes include stronger user harm regulations, clearer definitions for intermediaries, updated provisions on cybersecurity, and obligations on platforms to address deepfakes and misinformation. These updates aim to modernize the digital regulatory framework in line with current technological challenges. ",36.278999580000004,0.5,What are the latest amendments proposed in the Indian IT Act?,True,"The latest amendments proposed in the Indian IT Act include changes to social-media intermediary liability, stipulating that significant intermediaries may not be held liable without first being given an opportunity to be heard. Draft amendments were prepared within a fortnight and uploaded for public consultation on 2 Jan 2023. Stakeholder meetings occurred on 11 Jan, 17 Jan, and 16 Feb 2023."
2,How does the Supreme Court appoint judges in India?,0,True,"Judges of the Supreme Court of India are appointed through the Collegium System. The Collegium consists of the Chief Justice of India and the four senior-most judges. The Collegium recommends appointments and elevations, which the central government may accept or return for reconsideration, but if reaffirmed, the appointment becomes binding. ",26.557627110999874,0.5,"The appointment of judges to the Supreme Court of India is a complex process. The process involves the President of India, the Prime Minister, the Law Minister, and the Collegium of the Supreme Court. The Collegium, which consists of the Chief Justice of India and the four senior-most judges of the Supreme Court, recommends names to the President for appointment as judges. The President then consults with other stakeholders, including the Prime Minister and the Law Minister, before making the final appointments. Would you like more information on the Collegium system or the criteria for selecting judges?",True,"The Collegium system involves the Chief Justice of India and the four senior-most Supreme Court judges recommending names to the President for appointment as judges. The President then consults with the Prime Minister and Law Minister before making final appointments. This system, established through landmark judgments, aims to preserve judicial independence but faces criticism for lacking transparency and accountability."
3,Tell me the difference between civil law and criminal law.,0,False,"Civil law deals with disputes between private parties regarding rights and obligations, often involving compensation or injunctions. Criminal law concerns offenses against the state or society, where the government prosecutes individuals for conduct deemed harmful, with punishments such as imprisonment or fines. The burden of proof is higher in criminal law.",0.792438089000143,0.5,"Civil law and criminal law are two main branches of law that serve distinct purposes. Civil law deals with disputes between individuals, organizations, or businesses, typically involving issues related to rights, obligations, and liabilities. It aims to provide a remedy or compensation for harm suffered. In contrast, criminal law focuses on crimes committed against society as a whole, such as theft, assault, or murder. Its primary goal is to punish offenders and protect society. The procedures, penalties, and standards of proof also differ significantly between the two.",False,
4,What is the role of a Public Interest Litigation (PIL) in India?,0,True,"Public Interest Litigations in India allow individuals or groups to seek judicial intervention on matters affecting public rights, especially when marginalized communities are involved. The Supreme Court and High Courts entertain PILs to address issues such as environmental protection, government accountability, and human rights violations. PILs help expand access to justice. ",1.1251709050000045,0.5,"In India, a Public Interest Litigation (PIL) plays a crucial role in promoting justice and protecting the rights of citizens. It is a legal mechanism that allows individuals or organizations to file a lawsuit in the public interest, even if they are not directly affected by the issue. The primary objective of a PIL is to address issues that affect the general public, such as environmental degradation, human rights violations, corruption, and other matters of public concern. By filing a PIL, citizens can bring attention to these issues and seek relief or remedies from the courts. The Supreme Court and High Courts in India have been instrumental in entertaining PILs and providing directions to the government and other authorities to take corrective measures. Overall, PILs have been an effective tool for promoting accountability, transparency, and good governance in India.",False,
5,Explain how news bias can affect public policy decisions.,0,False,"News bias can distort public understanding by selectively presenting or framing issues. Policymakers, influenced by public opinion and media narratives, may prioritize issues amplified by the media while ignoring others. This can lead to skewed policy agendas, polarization, or misallocation of resources.",0.9746331209998971,1.0,"News bias can significantly affect public policy decisions by influencing public opinion and shaping the narrative around key issues. Biased reporting can lead to a skewed understanding of facts, creating an uneven playing field for policymakers. This can result in policies that cater to the interests of specific groups rather than the broader public. For instance, if news outlets consistently portray a certain group in a negative light, it can create a public perception that may not align with reality, ultimately influencing policy decisions that impact that group. Furthermore, news bias can also affect which issues receive attention and priority, potentially leading to policies that address the concerns of vocal minorities rather than the needs of the larger population. It's essential for both journalists and policymakers to be aware of these biases and strive for balanced reporting and decision-making processes.",False,
6,What are the key news outlets in the UK regulated by Ofcom?,0,True,"Major UK broadcasters regulated by Ofcom include the BBC, ITV, Channel 4, Channel 5, and Sky. Ofcom oversees broadcasting standards, impartiality rules, and content compliance to ensure accuracy and fairness in public communications. ",0.7393930160001219,1.0,"In the UK, Ofcom regulates the broadcasting sector, including television, radio, and on-demand services. Key news outlets regulated by Ofcom include BBC News, ITV News, Channel 4 News, Channel 5 News, Sky News, and GB News. Additionally, Ofcom regulates various local and regional news stations across the UK.",False,
7,How does the separation of powers work in the U.S. Constitution?,0,False,"The U.S. Constitution establishes three branches of government: legislative, executive, and judicial. Each branch has distinct powers and checks the others to prevent any single branch from becoming too powerful. This separation ensures accountability and balanced governance.",26.785477420999996,1.0,"The separation of powers in the U.S. Constitution refers to the division of power among the legislative, executive, and judicial branches. The legislative branch, composed of Congress, makes the laws. The executive branch, headed by the President, enforces the laws. The judicial branch, comprising the Supreme Court and other federal courts, interprets the laws. This separation is designed to provide checks and balances, ensuring that no one branch has too much power. I will search for more detailed information on the separation of powers in the U.S. Constitution.",True,"The separation of powers in the U.S. Constitution divides authority among the legislative, executive, and judicial branches. Congress (legislative) makes laws, the President (executive) enforces laws, and the Supreme Court and federal courts (judicial) interpret laws. This division provides checks and balances, preventing any one branch from having too much power."
8,Why is the right to privacy considered a fundamental right in India?,0,True,"The Supreme Court of India declared the right to privacy a fundamental right in the 2017 Puttaswamy judgment. The Court held that privacy is intrinsic to Article 21 (Right to Life and Personal Liberty) and essential for autonomy, dignity, and freedom of expression. ",0.913459537000108,1.0,"The right to privacy is considered a fundamental right in India because it is essential for the protection of an individual's dignity, autonomy, and freedom. The Indian Constitution, particularly Article 21, which guarantees the right to life and personal liberty, has been interpreted by the judiciary to include the right to privacy as a fundamental aspect of personal liberty. This interpretation was reinforced by the Supreme Court's landmark judgment in the case of Justice K.S. Puttaswamy (Retd.) vs Union of India (2017), where it was held that the right to privacy is a fundamental right protected under the Constitution.",False,
9,Can you summarize the recent G20 summit decisions related to climate policy?,0,True,"Recent G20 discussions emphasized accelerating renewable energy adoption, promoting climate finance for developing nations, and reducing greenhouse gas emissions. Leaders agreed to triple global renewable capacity by 2030 and strengthen adaptation measures. The summit stressed collaborative transitions toward low-carbon economies. ",30.161469371000067,0.5,Recent G20 summit decisions on climate policy,True,"The G20 has made commitments to keep ambition 'high' and push national actions toward Paris Agreement goals. Updated emission trajectories show significant reduction in projected warming through 2030. However, progress remains insufficient to meet the 1.5°C limit. The G20 is evolving into a multidimensional policy engine integrating climate, health, equity, and geopolitical considerations."
10,What is judicial review and how does it work?,0,False,"Judicial review allows courts to examine the constitutionality of legislative and executive actions. If a law or government action violates constitutional principles, courts may strike it down or require changes. This doctrine preserves the supremacy of the Constitution.",1.9759252569997443,1.0,"Judicial review is a process where a court reviews and potentially overturns a decision made by a government agency, lower court, or other administrative body. It is a critical check on the powers of the executive and legislative branches, ensuring they act within their legal authority and in accordance with the Constitution. Here's a simplified overview of how it works:

1. **Grounds for Review**: A party must have a valid reason to challenge the decision, such as an error of law, abuse of discretion, or violation of constitutional rights.

2. **Filing a Petition**: The party seeking review files a petition with the appropriate court, typically an appellate or supreme court.

3. **Review Process**: The court reviews the decision based on the petition, the record from the lower body, and legal arguments from both sides.

4. **Decision**: The court can uphold, reverse, or remand (send back) the decision. If the court finds the decision unlawful, it may order the agency or lower court to reconsider.

5. **Precedent and Impact**: Judicial review decisions set legal precedents, influencing future cases and guiding government actions.

This process varies by jurisdiction, but it remains a cornerstone of the rule of law and constitutional governance.",False,
11,Explain what a regulatory sandbox means in fintech.,0,False,A regulatory sandbox is a controlled environment where fintech companies can test innovative products under regulator supervision. It helps innovators experiment with reduced compliance burdens while regulators observe risks and impacts before broader rollout.,1.397245489999932,1.0,"A regulatory sandbox in fintech refers to a controlled environment created by regulatory bodies that allows fintech companies to test and experiment with innovative financial products, services, or business models in a real-world setting, while being exempt from certain regulatory requirements or having them relaxed. This sandbox environment enables fintech firms to assess the viability and potential impact of their offerings without being subject to the full weight of regulatory compliance, which can be costly and time-consuming. The goal is to foster innovation, encourage entrepreneurship, and facilitate the development of new financial technologies while ensuring that consumer protection and financial stability are maintained.",False,
12,How do elections in parliamentary democracies differ from presidential ones?,0,False,"In parliamentary democracies, the executive derives legitimacy from the legislature and remains accountable to it. In presidential systems, the president is directly elected and holds separate authority from the legislature. Parliamentary systems often enable faster legislative action, while presidential systems provide stronger executive independence.",1.755679389999841,1.0,"Elections in parliamentary democracies and presidential democracies differ in several key aspects. In parliamentary democracies, the head of government is typically a prime minister or chancellor who is accountable to the legislature (parliament). The party or coalition with the most seats in parliament usually forms the government, and the leader of that party or coalition becomes the head of government. 

In contrast, presidential democracies have a president who serves as both the head of state and head of government. The president is directly elected by the people and is not accountable to a legislature in the same way a prime minister is. 

Some of the main differences include: 

1. **Head of Government Selection:** In parliamentary systems, the head of government emerges from the legislature, while in presidential systems, the head of government (president) is directly elected.

2. **Separation of Powers:** Presidential systems often have a clear separation of powers between the executive (led by the president), the legislative, and the judicial branches. In parliamentary systems, there is a fusion of powers between the executive and legislative branches.

3. **Accountability:** In parliamentary systems, the executive (led by the prime minister) must maintain the confidence of the legislature and can be removed through a vote of no confidence. In presidential systems, the president has a fixed term and can be removed through impeachment or other constitutional processes.

4. **Election Focus:** Elections in parliamentary systems often focus on the parties and their platforms, while presidential elections focus on the candidates for president.

5. **Campaign Dynamics:** The dynamics of election campaigns also differ, with parliamentary elections often being more party-centric and presidential elections being more candidate-centric.",False,
13,Describe the concept of corporate governance and its importance.,0,False,"Corporate governance refers to the rules, processes, and structures guiding how companies are directed and controlled. It ensures accountability, fairness, and transparency in management. Good governance reduces risk, improves stakeholder trust, and promotes sustainable business performance.",0.6684372919999078,0.5,"Corporate governance refers to the system of rules, practices, and processes by which a company is directed and controlled. It involves balancing the interests of various stakeholders, including shareholders, management, customers, suppliers, and the community. The importance of corporate governance lies in its ability to promote transparency, accountability, and fairness in a company's operations, ultimately leading to better decision-making, improved performance, and increased trust among stakeholders.",False,
14,What is the difference between libel and slander in defamation law?,0,False,"Libel refers to defamatory statements made in written or permanent form, while slander refers to spoken defamation. Libel generally carries more severe legal consequences because written statements have wider reach and longer-lasting impact.",0.8096716310001284,1.0,"In defamation law, libel and slander are two types of defamatory statements. The main difference between them is the medium used to communicate the statement. Libel refers to written or published defamatory statements, while slander refers to spoken defamatory statements. For example, if someone writes a defamatory article about a person, it would be considered libel. On the other hand, if someone verbally makes a defamatory statement about a person, it would be considered slander. Both libel and slander can be actionable in court, and the plaintiff must prove that the defendant made a false statement that damaged their reputation.",False,
15,How does international law treat cybercrimes?,0,True,"International law addresses cybercrime primarily through multilateral treaties such as the Budapest Convention, which harmonizes cybercrime legislation and facilitates cross-border cooperation. Efforts by the UN focus on establishing norms for responsible state behavior and strengthening cybersecurity capabilities. ",33.10252851800033,1.0,How does international law treat cybercrimes?,True,"International law treats cybercrimes through various frameworks and agreements, focusing on cooperation, prevention, and prosecution. Key elements include the Budapest Convention on Cybercrime (2001), which sets a global standard for cybercrime laws, and the United Nations' efforts to establish a comprehensive cybercrime treaty. Countries are increasingly enacting national laws and regulations, often influenced by international norms and standards."
16,Explain the concept of judicial activism.,0,False,Judicial activism refers to situations where courts take a more proactive role in policymaking by interpreting laws broadly or filling legislative gaps. Courts may invoke activism to protect fundamental rights or address public issues when other branches fail to act.,0.8505337040000995,1.0,"Judicial activism refers to the practice of judges interpreting the law in a way that goes beyond the literal meaning of the statutes and precedents, often to advance a particular social or political agenda. This can involve striking down laws or government actions as unconstitutional, or interpreting laws in a broad or narrow way to achieve a desired outcome. Judicial activism is often contrasted with judicial restraint, where judges take a more limited role and defer to the other branches of government. Critics of judicial activism argue that it oversteps the judiciary's constitutional role and undermines the democratic process, while proponents argue that it allows courts to protect individual rights and ensure that the government acts within its constitutional limits.",False,
17,What are the legal implications of data protection laws like GDPR?,0,True,"The GDPR imposes strict rules on how organizations collect, process, store, and transfer personal data. It grants individuals rights such as access, rectification, portability, and erasure. Violations can lead to significant penalties, including fines of up to 4% of global annual turnover. ",30.38531263699997,0.5,What are the legal implications of data protection laws like GDPR?,True,The GDPR and other data protection laws give individuals stronger control over personal data and hold data controllers more accountable for breaches. They also highlight the need for precise purpose definition in data processing to satisfy the accountability principle and anchor the choice of legal basis. Non-compliance can result in significant penalties and reputational damage.
18,How do whistleblower protection laws work in India?,0,True,"The Whistle Blowers Protection Act, 2014 provides a mechanism for reporting corruption, abuse of power, or misuse of office by public servants. It aims to protect individuals who expose wrongdoing from retaliation. However, certain national security-related disclosures remain restricted. ",29.667803409000044,0.5,Whistleblower protection laws in India,True,"India's Whistleblower Protection Act, 2014, aims to safeguard individuals who disclose wrongdoing, corruption, or irregularities in public or private bodies. The law provides anonymity, confidentiality, and legal protection for whistleblowers, including protection against retaliation. However, implementation has been slow, and challenges remain, such as inconsistent enforcement at state levels and continued retaliation against whistleblowers."
19,Explain freedom of speech vs hate speech under the US First Amendment.,0,False,"The First Amendment protects freedom of speech, including offensive or disagreeable ideas. However, it does not protect incitement to imminent lawless action, true threats, or harassment. Hate speech is protected unless it directly provokes violence or constitutes targeted intimidation.",1.2307769470003223,0.5,"In the United States, the First Amendment protects freedom of speech, which generally allows individuals to express their thoughts, opinions, and ideas without government interference. However, the concept of hate speech has sparked debates about the limits of free speech. 

The First Amendment states, 'Congress shall make no law... abridging the freedom of speech.' But, the Supreme Court has established that not all speech is protected. Hate speech, which targets individuals or groups based on characteristics like race, ethnicity, religion, or sexual orientation, can be considered as falling outside the realm of protected speech in certain contexts. 

The key Supreme Court case on this issue is Brandenburg v. Ohio (1969), which ruled that speech is not protected if it incites imminent lawless action and is likely to incite or produce such action. For hate speech to be considered unprotected, it must be directed towards and likely to incite violence against a specific group. 

The line between protected speech and unprotected hate speech can be blurry. Public debates, academic discussions, and artistic expressions are generally protected, even if they include controversial or offensive ideas. On the other hand, speech that directly threatens or incites violence against specific individuals or groups may cross the line.

It's also important to note that private institutions, like social media platforms and employers, can set their own policies regarding speech, which may differ from the legal standards set by the First Amendment.",False,
